{
  "version": "1.1.0",
  "last_updated": "2026-09-02",
  "scope": {
    "regions": [
      "Hong Kong",
      "Singapore"
    ],
    "priority_universities": [
      "HKU",
      "HKUST",
      "CUHK",
      "NUS",
      "NTU"
    ],
    "degree_levels": [
      "graduate"
    ],
    "programme_types": [
      "coursework_master",
      "research_master",
      "phd",
      "mba_or_executive",
      "mixed_research_postgraduate",
      "multiple_programmes"
    ],
    "full_text_policy": "No third-party full essay is mirrored without explicit author permission or a compatible open license."
  },
  "records": [
    {
      "id": "hku-rpg-proposal-or-research-interest",
      "record_type": "official_requirement",
      "universities": [
        "HKU"
      ],
      "primary_university": "HKU",
      "region": "Hong Kong",
      "degree_level": "graduate",
      "programme_type": "mixed_research_postgraduate",
      "application_route": "research_postgraduate_general",
      "program": "MPhil / PhD",
      "cycle": "current",
      "requirement_status": "current",
      "outcome": null,
      "scholarship": null,
      "evidence_tier": "A",
      "quality_score": 99,
      "featured": true,
      "document_types": [
        "research_proposal",
        "statement_of_research_interest"
      ],
      "source": {
        "title": "Supporting Documents",
        "url": "https://gradsch.hku.hk/prospective_students/application/supporting_documents",
        "platform": "HKU Graduate School",
        "source_type": "official_university_requirement",
        "published_at": null
      },
      "copyright": {
        "full_text_in_repo": false,
        "policy": "link_and_original_analysis_only",
        "license": "source retains copyright"
      },
      "summary_zh": "HKU 研究型研究生申请按学院或项目要求提交研究计划或研究兴趣陈述。研究兴趣陈述应解释为何在 HKU 进行研究生学习；研究计划通常应交代研究背景、目标以及拟采用的方法或路径。",
      "strengths": [
        "先判断项目要求的是完整研究计划还是较短的研究兴趣陈述，不能用同一模板替代",
        "无论篇幅如何，都要同时回答研究问题、准备程度和 HKU 匹配度",
        "官方将背景、目标和方法列为研究计划的基本骨架"
      ],
      "limitations": [
        "页面提供的是全校层面的最低框架，具体篇幅和格式仍由学院决定",
        "该记录是官方要求，不是录取文书样本"
      ],
      "tags": [
        "research_postgraduate",
        "research_proposal",
        "research_interest",
        "official",
        "fit"
      ]
    },
    {
      "id": "hku-arts-phd-mphil-proposal-specifications",
      "record_type": "official_requirement",
      "universities": [
        "HKU"
      ],
      "primary_university": "HKU",
      "region": "Hong Kong",
      "degree_level": "graduate",
      "programme_type": "mixed_research_postgraduate",
      "application_route": "faculty_specific_research",
      "program": "Faculty of Arts MPhil / PhD",
      "cycle": "current",
      "requirement_status": "current",
      "outcome": null,
      "scholarship": null,
      "evidence_tier": "A",
      "quality_score": 98,
      "featured": true,
      "document_types": [
        "research_proposal"
      ],
      "source": {
        "title": "Faculties' Requirement Regarding Submission of Research Proposal and Statement of Research Interest from PhD/MPhil Applicants",
        "url": "https://gradsch.hku.hk/prospective_students/application/supporting_docum/requirements_of_the_faculty_and_programme",
        "platform": "HKU Graduate School",
        "source_type": "official_faculty_requirement",
        "published_at": null
      },
      "copyright": {
        "full_text_in_repo": false,
        "policy": "link_and_original_analysis_only",
        "license": "source retains copyright"
      },
      "summary_zh": "HKU 文学院 PhD 研究计划通常为双倍行距 4–5 页，需说明明确课题、研究问题、方法、价值与原创性并附参考书目；MPhil 通常为 3–4 页，还应交代学术经历、为何在 HKU 研究、初步阅读与可能面对的问题。",
      "strengths": [
        "PhD 文书把原创性、研究价值和方法放在核心位置，而不是扩写个人成长故事",
        "MPhil 允许研究设计仍是暂定的，但必须显示已开始阅读并能识别真正的问题",
        "参考书目是论证申请者已进入学术对话的重要证据"
      ],
      "limitations": [
        "这里只概括文学院规则，其他学院的页数和模板差异很大",
        "申请者仍需核对具体学系网页和当年表格"
      ],
      "tags": [
        "arts",
        "mphil",
        "phd",
        "research_proposal",
        "methodology",
        "originality"
      ]
    },
    {
      "id": "hku-maes-personal-statement-writing-sample",
      "record_type": "official_requirement",
      "universities": [
        "HKU"
      ],
      "primary_university": "HKU",
      "region": "Hong Kong",
      "degree_level": "graduate",
      "programme_type": "coursework_master",
      "application_route": "taught_postgraduate",
      "program": "MA in English Studies",
      "cycle": "2025-26",
      "requirement_status": "cycle_specific",
      "outcome": null,
      "scholarship": null,
      "evidence_tier": "A-",
      "quality_score": 92,
      "featured": false,
      "document_types": [
        "personal_statement",
        "academic_writing_sample",
        "scholarship_essay"
      ],
      "source": {
        "title": "2025-26 Full-time MAES",
        "url": "https://english.hku.hk/postgraduate/MAES/2025-26_Full-time",
        "platform": "HKU School of English",
        "source_type": "official_programme_requirement",
        "published_at": null
      },
      "copyright": {
        "full_text_in_repo": false,
        "policy": "link_and_original_analysis_only",
        "license": "source retains copyright"
      },
      "summary_zh": "HKU 英语研究文学硕士在 2025–26 轮次要求个人陈述、学术写作样本和两封推荐信；奖学金申请另有附加文书。该组合说明人文学科授课型硕士会同时评估动机叙事与实际学术写作能力。",
      "strengths": [
        "个人陈述负责解释学术兴趣和转向，写作样本负责直接证明分析与论证能力",
        "奖学金文书应补充影响力或潜力，不应机械重复主申请",
        "跨专业申请者需要用课程、阅读、写作或项目证明持续兴趣"
      ],
      "limitations": [
        "页面对应 2025–26 轮次，后续轮次可能改变材料要求",
        "官方页面没有公开个人陈述的具体题目或优秀样本"
      ],
      "tags": [
        "english_studies",
        "coursework_master",
        "personal_statement",
        "writing_sample",
        "scholarship"
      ]
    },
    {
      "id": "hku-msc-cs-personal-statement-optional",
      "record_type": "official_exception",
      "universities": [
        "HKU"
      ],
      "primary_university": "HKU",
      "region": "Hong Kong",
      "degree_level": "graduate",
      "programme_type": "coursework_master",
      "application_route": "taught_postgraduate",
      "program": "MSc in Computer Science",
      "cycle": "2026",
      "requirement_status": "current",
      "outcome": null,
      "scholarship": null,
      "evidence_tier": "A",
      "quality_score": 93,
      "featured": false,
      "document_types": [
        "optional_personal_statement",
        "cv"
      ],
      "source": {
        "title": "MSc Computer Science Programme FAQ",
        "url": "https://www.msc-cs.hku.hk/prj_faq",
        "platform": "HKU School of Computing and Data Science",
        "source_type": "official_programme_faq",
        "published_at": null
      },
      "copyright": {
        "full_text_in_repo": false,
        "policy": "link_and_original_analysis_only",
        "license": "source retains copyright"
      },
      "summary_zh": "HKU 计算机科学硕士当前 FAQ 明确要求提交 CV，但个人陈述是可选项。该记录用于提醒申请者：研究生申请并非所有项目都需要 SOP；若选择提交可选文书，它必须增加 CV 与成绩单之外的新证据。",
      "strengths": [
        "先服从项目材料逻辑，避免把通用 SOP 当作默认必交件",
        "可选文书应解决背景转换、异常成绩、项目匹配或职业路径等真实信息缺口",
        "不提交也不会自动构成材料缺失，申请重点仍在项目明确要求的文件"
      ],
      "limitations": [
        "“可选”不代表任何申请者提交都会加分",
        "FAQ 适用于该 MSc 项目，不能外推到 HKU 其他计算机或研究型项目"
      ],
      "tags": [
        "computer_science",
        "coursework_master",
        "optional_statement",
        "cv",
        "official_exception"
      ]
    },
    {
      "id": "hku-mfin-current-student-personal-statement-advice",
      "record_type": "admitted_case",
      "universities": [
        "HKU"
      ],
      "primary_university": "HKU",
      "region": "Hong Kong",
      "degree_level": "graduate",
      "programme_type": "coursework_master",
      "application_route": "official_current_student_application_advice",
      "program": "Master of Finance",
      "cycle": "Class of 2025",
      "requirement_status": "not_applicable",
      "outcome": "admitted_and_enrolled",
      "scholarship": null,
      "evidence_tier": "B+",
      "quality_score": 92,
      "featured": true,
      "document_types": [
        "personal_statement"
      ],
      "source": {
        "title": "Qishan Gong shares her HKU Master of Finance experience",
        "url": "https://www.linkedin.com/posts/hkubs-masters_%E6%B8%AF%E5%A4%A7%E7%B6%93%E7%AE%A1%E5%AD%B8%E9%99%A2-hku-hkufbe-activity-7302538286206459905-cDv0",
        "platform": "HKU Business School — Masters",
        "source_type": "official_current_student_interview",
        "published_at": null
      },
      "copyright": {
        "full_text_in_repo": false,
        "policy": "link_and_original_analysis_only",
        "license": "source retains copyright"
      },
      "summary_zh": "HKU 商学院官方账号采访了金融硕士 2025 届在读生 Qishan Gong。她建议在个人陈述中把学术背景、职业经历与职业目标进行定制化连接，并用对行业趋势的理解和相关判断补充履历之外的信息。",
      "strengths": [
        "把学术和职业经历解释为下一阶段目标的因果证据，而不是复述简历",
        "项目匹配连接具体职业方向、课程用途和所处行业",
        "以行业趋势和相关判断证明申请者对目标领域已有主动了解"
      ],
      "limitations": [
        "来源没有公开实际提交的个人陈述全文、逐段结构或完整申请背景",
        "这是在读生的回顾性建议，不能视为统一评分标准或证明个人陈述单独决定录取"
      ],
      "tags": [
        "finance",
        "coursework_master",
        "admitted_case",
        "personal_statement",
        "career_alignment",
        "industry_awareness",
        "current_student"
      ]
    },
    {
      "id": "hkust-rpg-research-plan-and-experience",
      "record_type": "official_requirement",
      "universities": [
        "HKUST"
      ],
      "primary_university": "HKUST",
      "region": "Hong Kong",
      "degree_level": "graduate",
      "programme_type": "mixed_research_postgraduate",
      "application_route": "research_postgraduate_general",
      "program": "MPhil / PhD",
      "cycle": "current",
      "requirement_status": "current",
      "outcome": null,
      "scholarship": null,
      "evidence_tier": "A",
      "quality_score": 99,
      "featured": true,
      "document_types": [
        "proposed_research_plan",